{"adapterFiles":[{"path":".ci-coordinator/ci-coordinator.cjs","sha256":"fc9c501135d5190b3e78611b1081d4bc7a1ae6e86861a0912d9b3dc7d92cd9fd"},{"path":".github/workflows/ci-coordinator-bootstrap.yml","sha256":"0a5deaf0f4d7bcb55b7752d92784beee605d9d8472853962839af349ff455a88"}],"generator":{"id":"target-artifacts","version":"1"},"profiles":[{"capacityClassId":"self-hosted-default","credentialProfileId":"no-credentials","executionKind":"witness-shards","fixtureProfileId":"no-fixtures","jobId":"selected-python-linux","permissionProfileId":"contents-read","profileId":"python-linux","runnerProfileId":"ubuntu-24-04","serviceProfileIds":[],"workflowPath":".github/workflows/ci-coordinator-bootstrap.yml"},{"capacityClassId":"self-hosted-default","credentialProfileId":"ephemeral-postgres","executionKind":"witness-shards","fixtureProfileId":"postgres-18.6","jobId":"selected-python-postgres","permissionProfileId":"contents-read","profileId":"python-postgres","runnerProfileId":"ubuntu-24-04","serviceProfileIds":["postgres-18.6"],"workflowPath":".github/workflows/ci-coordinator-bootstrap.yml"}],"schemaVersion":"dynamic-ci-target-execution-registry/v1","workflows":[{"executionJobs":[{"jobId":"selected-python-linux","needs":["plan"]},{"jobId":"selected-python-postgres","needs":["plan"]}],"executionKind":"witness-shards","fallbackJobId":"full-ci","gateJobId":"bootstrap-gate","gateSignalName":"Dynamic CI Bootstrap","planJobId":"plan","planRequestJobId":"plan-request","planRequestWorkflowRef":"example-org/ci-coordinator/.github/workflows/trusted-plan-request.yml@1111111111111111111111111111111111111111","requiredJobIds":[],"workflowPath":".github/workflows/ci-coordinator-bootstrap.yml"}]}
