{"adapterFiles":[{"path":".ci-coordinator/ci-coordinator.cjs","sha256":"fc9c501135d5190b3e78611b1081d4bc7a1ae6e86861a0912d9b3dc7d92cd9fd"},{"path":".github/workflows/full-check.yml","sha256":"d99835693e94b3a4ff33aacb771edc6baab814e96425cc417528b7dfa8b0d72f"}],"generator":{"id":"target-artifacts","version":"1"},"profiles":[{"capacityClassId":"hosted-default","credentialProfileId":"no-credentials","executionKind":"native-job-set","fixtureProfileId":"no-fixtures","jobId":"lint","permissionProfileId":"contents-read","profileId":"native-lint","runnerProfileId":"ubuntu-24-04","serviceProfileIds":[],"workflowPath":".github/workflows/full-check.yml"},{"capacityClassId":"hosted-default","credentialProfileId":"no-credentials","executionKind":"native-job-set","fixtureProfileId":"no-fixtures","jobId":"test","permissionProfileId":"contents-read","profileId":"native-test","runnerProfileId":"ubuntu-24-04","serviceProfileIds":[],"workflowPath":".github/workflows/full-check.yml"}],"schemaVersion":"dynamic-ci-target-execution-registry/v1","workflows":[{"executionJobs":[{"jobId":"lint","needs":["plan"]},{"jobId":"test","needs":["lint","plan"]}],"executionKind":"native-job-set","fallbackJobId":null,"gateJobId":"full-check-gate","gateSignalName":"Full Check","planJobId":"plan","planRequestJobId":"plan-request","planRequestWorkflowRef":"example-org/ci-coordinator/.github/workflows/trusted-plan-request.yml@1111111111111111111111111111111111111111","requiredJobIds":[],"workflowPath":".github/workflows/full-check.yml"}]}
